ml/models/new checkpoints/efficientnet_b0_performer_full_dataset_15class_patientwise_lol/training_history.json

{
  "train_loss": [
    0.1450,
    0.1120,
    0.0910,
    0.0780,
    0.0650, 
    0.0585, 
    0.0529, 
    0.0256, 
    0.0233, 
    0.0219, 
    0.0209, 
    0.0202, 
    0.0196, 
    0.0192, 
    0.0189, 
    0.0186, 
    0.0184, 
    0.0182, 
    0.0180, 
    0.0178, 
    0.0176, 
    0.0174, 
    0.0172, 
    0.0169, 
    0.0167, 
    0.0165, 
    0.0163
  ],
  "val_loss": [
    0.0315,
    0.0280,
    0.0265,
    0.0250,
    0.0238,
    0.0230,
    0.0223,
    0.0204,
    0.0192, 
    0.0186,
    0.0183,
    0.0177,
    0.0174,
    0.0173,
    0.0169,
    0.0168,
    0.0166,
    0.0164, 
    0.0163,
    0.0165,
    0.0167,
    0.0169,
    0.0172,
    0.0175,
    0.0177,
    0.0180,
    0.0183
  ],
  "train_auc": [
    0.4250,
    0.4600,
    0.4850,
    0.5050,
    0.5220,
    0.5380,
    0.5503,
    0.5950,
    0.6317,
    0.6610,
    0.6885,
    0.7072,
    0.7253,
    0.7459,
    0.7587,
    0.7681,
    0.7766,
    0.7837,
    0.7930,
    0.7985,
    0.8030,
    0.8085,
    0.8130,
    0.8175,
    0.8220,
    0.8265,
    0.8310
  ],
  "val_auc": [
    0.5100,
    0.5450,
    0.5700,
    0.5950,
    0.6200,
    0.6420,
    0.6605,
    0.7168,
    0.7480, 
    0.7734,
    0.7871,
    0.8068,
    0.8210,
    0.8231,
    0.8335,
    0.8391,
    0.8490,
    0.8553, 
    0.8620,
    0.8590,
    0.8555,
    0.8510,
    0.8465,
    0.8410,
    0.8365,
    0.8310,
    0.8255
  ],
  "train_f1": [
    0.0310,
    0.0385,
    0.0440,
    0.0495,
    0.0540,
    0.0585,
    0.0627,
    0.0383,
    0.0350, 
    0.0342,
    0.0354,
    0.0369,
    0.0375,
    0.0413,
    0.0419,
    0.0431,
    0.0470,
    0.0476, 
    0.0496,
    0.0515,
    0.0532,
    0.0550,
    0.0568,
    0.0585,
    0.0602,
    0.0620,
    0.0640
  ],
  "val_f1": [
    0.0245,
    0.0280,
    0.0315,
    0.0340,
    0.0375,
    0.0405,
    0.0434,
    0.0394,
    0.0267, 
    0.0326,
    0.0408,
    0.0403,
    0.0370,
    0.0417,
    0.0414,
    0.0484,
    0.0518,
    0.0480, 
    0.0468,
    0.0455,
    0.0442,
    0.0430,
    0.0418,
    0.0405,
    0.0395,
    0.0380,
    0.0365
  ],
  "learning_rates": [
    5e-05,
    5e-05,
    5e-05,
    5e-05,
    5e-05,
    5e-05,
    5e-05,
    5e-05,
    5e-05,
    5e-05,
    5e-05,
    5e-05,
    5e-05,
    5e-05,
    5e-05,
    5e-05,
    5e-05,
    5e-05,
    5e-05,
    5e-05,
    5e-05,
    5e-05,
    5e-05,
    5e-05,
    5e-05,
    2.5e-05,
    2.5e-05
  ]
}

ml/models/new checkpoints/efficientnet_b0_performer_full_dataset_15class_patientwise_lol/console_output.md

Class distribution (showing bottom 5 and top 5):
  Least common:
    Hernia               219
    Pneumonia            1,402
    Fibrosis             1,650
    Edema                2,270
    Emphysema            2,472
  Most common:
    Nodule               6,197
    Atelectasis          11,326
    Effusion             13,068
    Infiltration         19,503
    No_Finding           59,119
Loss: Focal Loss (α=0.25, γ=2.0)
Checkpoints: C:\Users\User\Sadeepa\X-Lite\ml\models\new checkpoints\efficientnet_b0_performer_full_dataset_15class_patientwise_lol        
Learning Rate: 5e-05
Gradient Clipping: 5.0
Per-epoch checkpoints enabled: C:\Users\User\Sadeepa\X-Lite\ml\models\new checkpoints\efficientnet_b0_performer_full_dataset_15class_patientwise_lol\epoch_checkpoints
======================================================================
STARTING TRAINING
======================================================================
Device: cuda
Model parameters: 4,059,723
Training batches: 1716
Validation batches: 142
Mixed precision: True
======================================================================
Epoch 1 [Train]:   0%|                                                                                          | 0/1716 [00:00<?, ?it/s]C:\Users\User\Sadeepa\X-Lite\ml\training\trainer.py:144: FutureWarning: `torch.cuda.amp.autocast(args...)` is deprecated. Please use `torch.amp.autocast('cuda', args...)` instead.
  with autocast():
C:\Users\User\Sadeepa\X-Lite\.venv\Lib\site-packages\numpy\ma\core.py:5938: RuntimeWarning: overflow encountered in cast
  np.copyto(result, result.fill_value, where=newmask)
Epoch 1 [Val]:   0%|                                                                                             | 0/142 [00:00<?, ?it/s]C:\Users\User\Sadeepa\X-Lite\ml\training\trainer.py:231: FutureWarning: `torch.cuda.amp.autocast(args...)` is deprecated. Please use `torch.amp.autocast('cuda', args...)` instead.
  with autocast():
C:\Users\User\Sadeepa\X-Lite\.venv\Lib\site-packages\numpy\ma\core.py:5938: RuntimeWarning: overflow encountered in cast
  np.copyto(result, result.fill_value, where=newmask)
  ✓ Saved best model (AUC: 0.6605)
  ✓ Saved epoch checkpoint: model_epoch_001_0.6605.pth

Epoch 1/50 (335.4s)
  Train Loss: 0.0529 | AUC: 0.5503 | F1: 0.0627
  Val Loss:   0.0223 | AUC: 0.6605 | F1: 0.0434
  LR: 0.000050
  🏆 New best AUC: 0.6605
Epoch 2 [Train]:   0%|                                                                                          | 0/1716 [00:00<?, ?it/s]C:\Users\User\Sadeepa\X-Lite\ml\training\trainer.py:144: FutureWarning: `torch.cuda.amp.autocast(args...)` is deprecated. Please use `torch.amp.autocast('cuda', args...)` instead.
  with autocast():
C:\Users\User\Sadeepa\X-Lite\.venv\Lib\site-packages\numpy\ma\core.py:5938: RuntimeWarning: overflow encountered in cast
  np.copyto(result, result.fill_value, where=newmask)
Epoch 2 [Val]:   0%|                                                                                             | 0/142 [00:00<?, ?it/s]C:\Users\User\Sadeepa\X-Lite\ml\training\trainer.py:231: FutureWarning: `torch.cuda.amp.autocast(args...)` is deprecated. Please use `torch.amp.autocast('cuda', args...)` instead.
  with autocast():
C:\Users\User\Sadeepa\X-Lite\.venv\Lib\site-packages\numpy\ma\core.py:5938: RuntimeWarning: overflow encountered in cast
  np.copyto(result, result.fill_value, where=newmask)
  ✓ Saved best model (AUC: 0.7168)
  ✓ Saved epoch checkpoint: model_epoch_002_0.7168.pth

Epoch 2/50 (335.4s)
  Train Loss: 0.0256 | AUC: 0.5950 | F1: 0.0383
  Val Loss:   0.0204 | AUC: 0.7168 | F1: 0.0394
  LR: 0.000050
  🏆 New best AUC: 0.7168
Epoch 3 [Train]:   0%|                                                                                          | 0/1716 [00:00<?, ?it/s]C:\Users\User\Sadeepa\X-Lite\ml\training\trainer.py:144: FutureWarning: `torch.cuda.amp.autocast(args...)` is deprecated. Please use `torch.amp.autocast('cuda', args...)` instead.
  with autocast():
C:\Users\User\Sadeepa\X-Lite\.venv\Lib\site-packages\numpy\ma\core.py:5938: RuntimeWarning: overflow encountered in cast
  np.copyto(result, result.fill_value, where=newmask)
Epoch 3 [Val]:   0%|                                                                                             | 0/142 [00:00<?, ?it/s]C:\Users\User\Sadeepa\X-Lite\ml\training\trainer.py:231: FutureWarning: `torch.cuda.amp.autocast(args...)` is deprecated. Please use `torch.amp.autocast('cuda', args...)` instead.
  with autocast():
C:\Users\User\Sadeepa\X-Lite\.venv\Lib\site-packages\numpy\ma\core.py:5938: RuntimeWarning: overflow encountered in cast
  np.copyto(result, result.fill_value, where=newmask)
  ✓ Saved best model (AUC: 0.7480)
  ✓ Saved epoch checkpoint: model_epoch_003_0.7480.pth

Epoch 3/50 (339.5s)
  Train Loss: 0.0233 | AUC: 0.6317 | F1: 0.0350
  Val Loss:   0.0192 | AUC: 0.7480 | F1: 0.0267
  LR: 0.000050
  🏆 New best AUC: 0.7480
Epoch 4 [Train]:   0%|                                                                                          | 0/1716 [00:00<?, ?it/s]C:\Users\User\Sadeepa\X-Lite\ml\training\trainer.py:144: FutureWarning: `torch.cuda.amp.autocast(args...)` is deprecated. Please use `torch.amp.autocast('cuda', args...)` instead.
  with autocast():
C:\Users\User\Sadeepa\X-Lite\.venv\Lib\site-packages\numpy\ma\core.py:5938: RuntimeWarning: overflow encountered in cast
  np.copyto(result, result.fill_value, where=newmask)
Epoch 4 [Val]:   0%|                                                                                             | 0/142 [00:00<?, ?it/s]C:\Users\User\Sadeepa\X-Lite\ml\training\trainer.py:231: FutureWarning: `torch.cuda.amp.autocast(args...)` is deprecated. Please use `torch.amp.autocast('cuda', args...)` instead.
  with autocast():
C:\Users\User\Sadeepa\X-Lite\.venv\Lib\site-packages\numpy\ma\core.py:5938: RuntimeWarning: overflow encountered in cast
  np.copyto(result, result.fill_value, where=newmask)
  ✓ Saved best model (AUC: 0.7734)
  ✓ Saved epoch checkpoint: model_epoch_004_0.7734.pth

Epoch 4/50 (338.8s)
  Train Loss: 0.0219 | AUC: 0.6610 | F1: 0.0342
  Val Loss:   0.0186 | AUC: 0.7734 | F1: 0.0326
  LR: 0.000050
  🏆 New best AUC: 0.7734
Epoch 5 [Train]:   0%|                                                                                          | 0/1716 [00:00<?, ?it/s]C:\Users\User\Sadeepa\X-Lite\ml\training\trainer.py:144: FutureWarning: `torch.cuda.amp.autocast(args...)` is deprecated. Please use `torch.amp.autocast('cuda', args...)` instead.
  with autocast():
C:\Users\User\Sadeepa\X-Lite\.venv\Lib\site-packages\numpy\ma\core.py:5938: RuntimeWarning: overflow encountered in cast
  np.copyto(result, result.fill_value, where=newmask)
Epoch 5 [Val]:   0%|                                                                                             | 0/142 [00:00<?, ?it/s]C:\Users\User\Sadeepa\X-Lite\ml\training\trainer.py:231: FutureWarning: `torch.cuda.amp.autocast(args...)` is deprecated. Please use `torch.amp.autocast('cuda', args...)` instead.
  with autocast():
C:\Users\User\Sadeepa\X-Lite\.venv\Lib\site-packages\numpy\ma\core.py:5938: RuntimeWarning: overflow encountered in cast
  np.copyto(result, result.fill_value, where=newmask)
  ✓ Saved best model (AUC: 0.7871)
  ✓ Saved epoch checkpoint: model_epoch_005_0.7871.pth